{
  "summary": "Dinner reservation for 2 at La Terraza",
  "description": "Requested by Synvya Concierge. Please arrive 5 minutes early.",
  "starts_at": "2025-10-17T19:00:00-07:00",
  "ends_at": "2025-10-17T21:00:00-07:00",
  "timezone": "America/Los_Angeles",
  "location": "123 Pike St, Seattle, WA",
  "party_size": 2,
  "guest_contact": {
    "name": "Alejandro",
    "phone": "+1-555-0100",
    "email": "alejandro@example.com"
  },
  "external_refs": [
    {
      "system": "square",
      "id": "resv_abc123"
    }
  ]
}